Timestamp,Choose / Pumili,Pangalan (opsyonal),Edad,Ano ang iyong role,"Paano ka karaniwang nagbo-book ng mga akomodasyon sa resort? (e.g., online, telepono, personal)",Anong mga katangian ang pinaka-mahalaga sa iyo kapag gumagamit ng online booking platform?,Gumamit ka na ba ng platform na may virtual tours para sa booking? Paano ang iyong karanasan?,Ano ang pinakamalaking hamon na hinaharap mo sa kasalukuyang mga online booking systems?,Paano makakaapekto ang virtual tour sa iyong desisyon na mag-book ng resort?,Anong karagdagang impormasyon ang nais mong makita sa pahina ng booking ng isang resort?,Gaano kahalaga sa iyo na makita ang mga review at rating ng mga bisita bago mag-book?,Mayroon bang mga partikular na katangian na sa tingin mo ay nawawala sa kasalukuyang mga booking platforms?,Gaano ka nasisiyahan sa antas ng impormasyong ibinibigay tungkol sa mga resort sa mga umiiral na platform?,Gaano mo magugustuhan gumamit ng bagong booking platform na may kasamang virtual tours at interactive na mga katangian?
9/12/2024 20:42:56,Tagalog,,19,Bisita ng resort,online,murang halaga,hindi pa ,maraming posts mahirap mamili,5,"Virtual tour ng resort, Detalyadong paglalarawan ng mga amenities, Mga review at rating ng bisita, Mataas na kalidad ng mga larawan at video, Detalye ng presyo at availability calendar, Pagkakataon na ikumpara ang iba't ibang resorts, Mga espesyal na alok at diskwento, Impormasyon tungkol sa mga lokal na atraksyon",5,"Virtual tour feature, Enhanced search filters, Mas detalyadong paglalarawan ng resort, Mas magandang user interface, Real-time booking updates, Integrasyon sa social media, Mobile-friendly na disenyo, Mas magandang customer support, Mas personalized na rekomendasyon",5,5
9/12/2024 20:41:47,Tagalog,Rodelito Bataller,27,Bisita ng resort,Online,"Accessible sa lahat, malinaw ang instructions, at hindi mahirap gamitin.",Hindi pa.,Mabagal na internet.,5,"Virtual tour ng resort, Detalyadong paglalarawan ng mga amenities, Mga review at rating ng bisita, Mataas na kalidad ng mga larawan at video, Detalye ng presyo at availability calendar, Interactive na mapa ng layout ng resort, Pagkakataon na ikumpara ang iba't ibang resorts, Mga espesyal na alok at diskwento, Impormasyon tungkol sa mga lokal na atraksyon",3,"Virtual tour feature, Enhanced search filters, Mas detalyadong paglalarawan ng resort, Mas magandang user interface, Real-time booking updates, Integrasyon sa social media, Mobile-friendly na disenyo, Mas magandang customer support, Mas personalized na rekomendasyon",3,3
9/12/2024 20:56:23,Tagalog,,27,Bisita ng resort,Online,Kumpleto ang detalye ng resort,Pictures lang,Scammers,5,"Detalyadong paglalarawan ng mga amenities, Mga review at rating ng bisita, Mataas na kalidad ng mga larawan at video, Detalye ng presyo at availability calendar, Impormasyon tungkol sa mga lokal na atraksyon",4,"Virtual tour feature, Mas detalyadong paglalarawan ng resort, Mas personalized na rekomendasyon",3,5
9/12/2024 20:20:39,Tagalog,Pam,31,Bisita ng resort,Online or personal,Accurate na information at timely update,Oo,Minsan ay fully booked na pero tumatanggap parin ng booking,5,"Virtual tour ng resort, Detalyadong paglalarawan ng mga amenities, Mga review at rating ng bisita, Detalye ng presyo at availability calendar, Interactive na mapa ng layout ng resort, Pagkakataon na ikumpara ang iba't ibang resorts",5,"Virtual tour feature, Mas detalyadong paglalarawan ng resort, Mas magandang customer support",3,5
9/12/2024 20:33:06,Tagalog,,32,Bisita ng resort,personal at telepono,mga picture at video ng resort,parang hindi pa,mahirap makita kung may karaoke or billiard sa loob,4,"Detalyadong paglalarawan ng mga amenities, Mga review at rating ng bisita, Mataas na kalidad ng mga larawan at video, Detalye ng presyo at availability calendar, Pagkakataon na ikumpara ang iba't ibang resorts, Mga espesyal na alok at diskwento",4,"Enhanced search filters, Mas detalyadong paglalarawan ng resort, Mas magandang user interface, Real-time booking updates, Mas magandang customer support, Mas personalized na rekomendasyon",4,4
9/12/2024 21:21:53,Tagalog,John Henrie Dalisay Mane,37,Bisita ng resort,Inquiry sa Page through facebook or contact number ng Reaort,Madali at Hustle free na pag renta,Hindi,System problem at delay or matagal na respond,1,"Virtual tour ng resort, Detalyadong paglalarawan ng mga amenities, Mga review at rating ng bisita, Mataas na kalidad ng mga larawan at video, Detalye ng presyo at availability calendar, Mga espesyal na alok at diskwento",4,"Mas detalyadong paglalarawan ng resort, Mas magandang customer support",3,5
9/12/2024 21:06:24,Tagalog,Rommel Dela Cruz,45,Bisita ng resort,Online booking,Para maayos schedul ,Oo,Ma ayos lahat bago Ang schedule,2,"Virtual tour ng resort, Mga espesyal na alok at diskwento",5,Virtual tour feature,5,3
